JTK06,B-W2TELCP03-W14G/0,STD,RR01,B-W2TELCP03-W14G,,,Wardah Tester Container Evd Lum Compact Powder 03 Ivory 14 g,,,NOMINAL_LINE,,0,0,0,1,1
JTK04,L-PS04-MO/100,STD,SR09,L-PS04-MO,,L-PS04-BULK,MAKE OVER Powerstay Superlast Lip Cream 04 6 g,,MAKE OVER Powerstay Superlast Lip Cream 04,NOMINAL_LINE,1,100,100,98,14846,15142
JTK01,DUSS-PMFC31R0-MO/0,SFGPack,PR16,DUSS-PMFC31R0-MO,,,Dus Sticker Powerstay Matte Powder Foundation C31 MO,,,NOMINAL_LINE,,0,0,0,1200,1236
JTK02,BOTP-PCSSLREV14-P/0,SFGPack,LR13,BOTP-PCSSLREV14-P,,,Botol Print Pure clean shampo spa lemon  Rev-1 450ml Putri,,,NOMINAL_LINE,,0,0,0,1,1
JTK04,L-MLCC-OMG/100,STD,SR09,L-MLCC-OMG,,L-MLCC-BULK,OMG OH MY GLAM Matte Kiss Lip Cream 03 Flame 3.5 g,,OMG OH MY GLAM Matte Kiss Lip Cream 03 Flame,SECONDARY_LINE,1,100,100,97,26916,27051
JTK04,L-MLCC-OMG/45,STD,SR09,L-MLCC-OMG,,L-MLCC-BULK,OMG OH MY GLAM Matte Kiss Lip Cream 03 Flame 3.5 g,,OMG OH MY GLAM Matte Kiss Lip Cream 03 Flame,NOMINAL_LINE,1,45,45,43.25,11976,12156
JTK06,MY-BOCOCBSC-W/0,STD,RR01,MY-BOCOCBSC-W,,,Malaysia Wardah Colorfit Cream Blush 01 SAND CORAL 3 g,,,NOMINAL_LINE,,0,0,0,2627,2627
JTK06,L-TLL15-W2.3G/0,STD,RR01,L-TLL15-W2.3G,,,Wardah Tester Lipstick Longlasting 15 Rouge Red 2.3 g (Pc(s)),,,NOMINAL_LINE,,0,0,0,1,1
JTK06,MY-LEMC02-W4G/0,STD,RR01,MY-LEMC02-W4G,,,Malaysia Wardah Exclusive Matte Lip Cream 02 Fuschionately 4 g (Pc(s)),,,NOMINAL_LINE,,0,0,0,1,1
JTK02,SRM-ELB-W/100,STD,LR02,SRM-ELB-W,,SRM-ELB-BULK,Wardah Eyexpert Brow Lash Serum 10 ml,,Wardah Eyexpert Lash and Brow Serum,NOMINAL_LINE,1,100,100,90,7344,7680
JTK06,MY-FWAN1-EM/0,STD,RR01,MY-FWAN1-EM,,,Malaysia Emina Natura Pal Gel Cleanser 100 ml,,,NOMINAL_LINE,,0,0,0,1,1
JTK06,MY-LEMC08-W4G/0,STD,RR01,MY-LEMC08-W4G,,,Malaysia Wardah Exclusive Matte Lip Cream 08 Pinkcredible 4 g (Pc(s)),,,NOMINAL_LINE,,0,0,0,1,1
JTK06,MY-FCLCME-W/0,STD,RR01,MY-FCLCME-W,,,Malaysia Wardah Colorfit Matte Foundation 33W Olive Beige 25 ml,,,NOMINAL_LINE,,0,0,0,1,1
JTK06,MY-BOCLPPMCB-EM/0,STD,RR01,MY-BOCLPPMCB-EM,,,Malaysia Emina Cheek Lit Pressed Blush Cherry Blossoms 3.5 gr (Pc(s)),,,NOMINAL_LINE,,0,0,0,1,1
JTK02,CM-RWSPBC-W/1000,STD,LR01,CM-RWSPBC-W,,CM-RWSPBC-BULK,Wardah Crystal Secret Melting Milk Cleanser 100 ml,,Wardah Crystal Secret Melting Milk Cleanser,NOMINAL_LINE,1,1000,1000,977,9518,9800
JTK06,L-CVM06LE-W/0,STD,RR01,L-CVM06LE-W,,,Wardah Colorfit Velvet Matte Lip Mousse - Women's Day Special Edition 06 Fuchsia Lover 4 g,,,NOMINAL_LINE,,0,0,0,1,1
JTK06,MY-MRWSDCN2-W/0,STD,RR01,MY-MRWSDCN2-W,,,Malaysia Wardah Crystal Secret Brightening Day Cream 30 g,,,NOMINAL_LINE,,0,0,0,1,1
JTK02,F-CLCMG-W/240,STD,LR20,F-CLCMG-W,,F-CLCMG-BULK,Wardah Colorfit Matte Foundation 42N Neutral Sand 25 ml,,Wardah Colorfit Matte Foundation 42N Neutral Sand bulk,SECONDARY_LINE,1,240,240,215,7874,8268
JTK02,F-CLCMG-W/120,STD,LR20,F-CLCMG-W,,F-CLCMG-BULK,Wardah Colorfit Matte Foundation 42N Neutral Sand 25 ml,,Wardah Colorfit Matte Foundation 42N Neutral Sand bulk,NOMINAL_LINE,1,120,120,120,3994,4194
JTK02,F-CLCMG-W/50,STD,LR10,F-CLCMG-W,,F-CLCMG-BULK,Wardah Colorfit Matte Foundation 42N Neutral Sand 25 ml,,Wardah Colorfit Matte Foundation 42N Neutral Sand bulk,SECONDARY_LINE,1,50,50,50,1304,1404
JTK06,MY-LBSTSPC-EM/0,STD,RR01,MY-LBSTSPC-EM,,,Malaysia Emina Oh So Kissable Tinted Balm Stick Plum Candy 3.4 g,,,NOMINAL_LINE,,0,0,0,1,1
JTK02,N-P1L-P2/500,STD,LR15,N-P1L-P2,,N-L-BULK,Putri Neutralizer Lotion 2 L (Pc(s)),,Bulk Neutralizer,SECONDARY_LINE,1,500,500,495,224,324
JTK02,N-P1L-P2/200,STD,LR15,N-P1L-P2,,N-L-BULK,Putri Neutralizer Lotion 2 L (Pc(s)),,Bulk Neutralizer,SECONDARY_LINE,1,200,200,200,90,100
JTK02,N-P1L-P2/100,STD,LR15,N-P1L-P2,,N-L-BULK,Putri Neutralizer Lotion 2 L (Pc(s)),,Bulk Neutralizer,NOMINAL_LINE,1,100,100,100,48,50
JTK06,MY-LCLCLS4-W/0,STD,RR01,MY-LCLCLS4-W,,,Malaysia Wardah Colorfit Fresh Matte Lip Ink 04 Speedster 4 g,,,NOMINAL_LINE,,0,0,0,4745,4745
JTK02,FW-RPBCFLSN3-W/3000,STD,LR02,FW-RPBCFLSN3-W,,FW-RPBCFLS-BULK,Wardah Perfect Bright Creamy Foam Bright + Smooth Glow 6 x 20 ml (Non Hanger),,Wardah Perfect Bright Creamy Foam Bright + Smooth Glow,SECONDARY_LINE,1,3000,3000,2970,23373,24075
JTK02,FW-RPBCFLSN3-W/1000,STD,LR02,FW-RPBCFLSN3-W,,FW-RPBCFLS-BULK,Wardah Perfect Bright Creamy Foam Bright + Smooth Glow 6 x 20 ml (Non Hanger),,Wardah Perfect Bright Creamy Foam Bright + Smooth Glow,NOMINAL_LINE,1,1000,1000,970,7579,7800
JTK02,HBW-RPEHB-KA/3000,STD,LR15,HBW-RPEHB-KA,,HBW-EHB-BULK,Kahf Energizing Body Wash - Refill Pouch 400 ml,,Kahf Energizing Hair and Body Wash Bulk,NOMINAL_LINE,1,3000,3000,2910,7199,7420
JTK02,FT-GSEH-L/1000,STD,LR15,FT-GSEH-L,,FT-GSEH-BULK,LABORE Sensitive Skin Care GentleBiome Hydration Toner 100 ml,,LABORÉ Sensitive Skin Care GentleBiome Hydration Toner,NOMINAL_LINE,1,1000,1000,981.6,9655,9945
JTK02,F-EXL02-MO/50,STD,LR10,F-EXL02-MO,,F-EXL02-BULK,MAKE OVER Expert Liquid Foundation 02 30 ml,,MAKE OVER Expert Liquid Foundation 02,NOMINAL_LINE,1,50,50,43,1032,1186
JTK02,F-LLF01-W/1000,STD,LR20,F-LLF01-W,,F-LLF01-BULK,Wardah Lightening Liquid Foundation 01. Light Beige 25 ml (Blister),,Wardah Lightening Liquid Foundation 01. Light Beige bulk,SECONDARY_LINE,1,1000,1000,975,32934,33923
JTK02,F-LLF01-W/600,STD,LR20,F-LLF01-W,,F-LLF01-BULK,Wardah Lightening Liquid Foundation 01. Light Beige 25 ml (Blister),,Wardah Lightening Liquid Foundation 01. Light Beige bulk,NOMINAL_LINE,1,600,600,570,19386,20356
JTK02,F-LLF01-W/300,STD,LR20,F-LLF01-W,,F-LLF01-BULK,Wardah Lightening Liquid Foundation 01. Light Beige 25 ml (Blister),,Wardah Lightening Liquid Foundation 01. Light Beige bulk,SECONDARY_LINE,1,300,300,300,9706,9998
JTK04,DUSS-CADLP16R0-W/0,SFGPack,SR12,DUSS-CADLP16R0-W,,,Dus Sticker CAD Lip Paint 16 W,,,NOMINAL_LINE,1,0,0,0,46656,46856
JTK01,BO-E01-W/14,PRESSTHENFILLINGPACKING,PR03,BO-E01-W,"BO-E01-W-RP-W6,5GR",BO-E01-W-BULK,Wardah Exclusive Blush On 01 Rosy Pink 6.5 g,Refill Press Blush on Exclusive 01 Rosy Pink,Wardah Exclusive Blush On 01 Rosy Pink,NOMINAL_LINE,1,14,14,14,1776,1829
JTK02,HT-P1Y1-P200/1000,STD,LR15,HT-P1Y1-P200,,HT-Y1-BULK,"Hair Tonic Normal Hair (Yellow), 200 ml",,Bulk Hair Tonic Yellow,NOMINAL_LINE,1,1000,1000,985,5184,5444
JTK02,HT-P1Y1-P200/1000,STD,LR15,HT-P1Y1-P200,,HT-Y1-BULK,"Hair Tonic Normal Hair (Yellow), 200 ml",,Bulk Hair Tonic Yellow,NOMINAL_LINE,1,1000,1000,985,5184,5444
JTK06,MY-LGS01-EM/0,STD,RR01,MY-LGS01-EM,,,Malaysia Emina Glossy Stain 01 Autumn Bell 3 g,,,NOMINAL_LINE,,0,0,0,1,1
JTK06,P-WLCDN-W/0,STD,RR01,P-WLCDN-W,,,Watsons Bundling Package Lebaran Wardah C-Defense DD Cream Natural + Wardah C-Defense Face Mist Lebaran 2020,,,NOMINAL_LINE,,0,0,0,1,1
JTK04,L-SR15MC-EM/5,STD,SR09,L-SR15MC-EM,,L-SR15MC-BULK,Emina Sugar Rush Lipstick 15 Maple Crunch 3.8 g,,Emina Sugar Rush Lipstick 15 Maple Crunch,SECONDARY_LINE,1,5,5,4.75,1036,1057
JTK04,L-SR15MC-EM/0.75,STD,SR09,L-SR15MC-EM,,L-SR15MC-BULK,Emina Sugar Rush Lipstick 15 Maple Crunch 3.8 g,,Emina Sugar Rush Lipstick 15 Maple Crunch,NOMINAL_LINE,1,0.75,0.75,0.5,60,84
JTK01,BO-CLPBAC-EM/18,PRESSTHENFILLINGPACKING,PR03,BO-CLPBAC-EM,"BO-CLPBAC-RP-EM3,5GR",BO-CLPBAC-BULK,Emina Cheek Lit Pressed Blush Apple Crumble 3.5 g,Refill Press EMINA Cheek Lit Pressed Blush Apple Crumble,EMINA Cheek Lit Pressed Blush Apple Crumble,SECONDARY_LINE,1,18,18,18,3840,3955
JTK01,BO-CLPBAC-EM/14,PRESSTHENFILLINGPACKING,PR03,BO-CLPBAC-EM,"BO-CLPBAC-RP-EM3,5GR",BO-CLPBAC-BULK,Emina Cheek Lit Pressed Blush Apple Crumble 3.5 g,Refill Press EMINA Cheek Lit Pressed Blush Apple Crumble,EMINA Cheek Lit Pressed Blush Apple Crumble,NOMINAL_LINE,1,14,14,14,3000,3090
JTK06,P-IPR3-W/0,STD,RR01,P-IPR3-W,,,Instaperfect Step Up Longlast Look Hampers,,,NOMINAL_LINE,,0,0,0,2000,2000
JTK06,MY-TLBO-W6.5G/0,STD,RR01,MY-TLBO-W6.5G,,,Wardah Tester Lipbalm Orange 6.5 g,,,NOMINAL_LINE,,0,0,0,1,1
JTK02,LAR-WYL%-BULK/5,SFGBulk,LR03,LAR-WYL%-BULK,,,"Larutan Warna Yellow Larut Minyak 0,004 % Bulk",,,NOMINAL_LINE,1,5,5,5,0,0
JTK02,M-CSRRC-W/400,STD,LR02,M-CSRRC-W,,M-CSRRC-BULK,Wardah Crystallure Supreme Revitalizing Rich Cream 50 g,,Moisturizer-pelembab Crystallure Supreme Revitaliz Bulk (Kg),SECONDARY_LINE,1,400,400,370,7032,7384
JTK02,M-CSRRC-W/200,STD,LR02,M-CSRRC-W,,M-CSRRC-BULK,Wardah Crystallure Supreme Revitalizing Rich Cream 50 g,,Moisturizer-pelembab Crystallure Supreme Revitaliz Bulk (Kg),NOMINAL_LINE,1,200,200,185,3516,3692
JTK06,F-W2TELN04-W20ML/0,STD,RR01,F-W2TELN04-W20ML,,,Wardah Tester Exclusive Liquid Foundation 04 Natural 20 ml (Pc(s)),,,NOMINAL_LINE,,0,0,0,1,1
JTK02,WARN-LT--BULK/1.84299999999999997,SFGBulk,LR03,WARN-LT--BULK,,,Warna Lemon Top,,,NOMINAL_LINE,1,1.843,1.843,1.843,0,0
JTK01,TWC-CLFTRH-W/20,STD,PR01,TWC-CLFTRH-W,,TWC-CLFTH-BULK,Wardah Colorfit Velvet Powder Foundation Refill 52N Almond 11 g,,Colorfit Velvet Powder Foundation 52N Almond,NOMINAL_LINE,1,20,20,20,1548,1600
JTK01,TC-W3ELLI4-W12G/60,STD,PR01,TC-W3ELLI4-W12G,,TC-W1I2C4-BULK,Wardah Evd Lum Two Way Cake 04 Light Ivory 12 g (Pc(s)),,Luminous Two Way Cake 04,NOMINAL_LINE,1,60,60,60,4212,4338
JTK02,SRM-BSSN2-EM/600,STD,LR02,SRM-BSSN2-EM,,SRM-BSS-BULK,Emina Bright Stuff Face Serum 7.5 ml,,EMINA Bright Stuff Face Serum Bulk,SECONDARY_LINE,1,600,600,570,69543,70543
JTK02,SRM-BSSN2-EM/300,STD,LR02,SRM-BSSN2-EM,,SRM-BSS-BULK,Emina Bright Stuff Face Serum 7.5 ml,,EMINA Bright Stuff Face Serum Bulk,NOMINAL_LINE,1,300,300,293,35017,36017
JTK02,S-P1A2-P2/1000,STD,LR15,S-P1A2-P2,,S-A2L-BULK,Putri Pure Clean Shampoo Apple 2 L (Pc(s)),,Shampoo Apple Liter BULK (Kg),SECONDARY_LINE,1,1000,1000,974,460,560
JTK02,S-P1A2-P2/600,STD,LR15,S-P1A2-P2,,S-A2L-BULK,Putri Pure Clean Shampoo Apple 2 L (Pc(s)),,Shampoo Apple Liter BULK (Kg),NOMINAL_LINE,1,600,600,570,267,367
JTK06,MY-FCLCMD-W/0,STD,RR01,MY-FCLCMD-W,,,Malaysia Wardah Colorfit Matte Foundation 32N Neutral Beige 25 ml,,,NOMINAL_LINE,,0,0,0,1,1
JTK02,FM-NDASR-W/50,STD,LR15,FM-NDASR-W,,FM-NDASR-BULK,Wardah Nature Daily Alpine Apple Nutritive Gel Capsule Mask 10 ml,,Face Mask Nature Daily Alpine Apple Skin Bulk (Kg),NOMINAL_LINE,1,50,50,50,3542,3650
JTK02,FM-NDASR-W/30,STD,LR15,FM-NDASR-W,,FM-NDASR-BULK,Wardah Nature Daily Alpine Apple Nutritive Gel Capsule Mask 10 ml,,Face Mask Nature Daily Alpine Apple Skin Bulk (Kg),SECONDARY_LINE,1,30,30,26,2268,2382
JTK04,L-IPEI02-W/3,STD,SR09,L-IPEI02-W,,L-IPEI02-BULK,Wardah Instaperfect Everlast Intense Matte Liquid 02 TIMELESS 4.2 g,,Wardah Instaperfect Everlast Intense Matte Liquid 02 TIMELESS,NOMINAL_LINE,1,3,3,2.75,444,467
JTK01,ES-EP01-W/72,COPACKING,PR03,ES-EP01-W,ES-EP01-W-08-RP-W1GR,ES-EP01-W-08-BULK,Wardah Exclusive Eyeshadow Palette 01 Sunset Brown 10 g,Refill Press Exclusive Eye Shadow Palette 01 Sunset Brown 08,Exclusive Eye Shadow Palette 01 Sunset Brown 08,NOMINAL_LINE,8,72,9,9,4428,4561
JTK01,ES-EP01-W/72,COPACKING,PR03,ES-EP01-W,ES-EP01-W-07-RP-W1GR,ES-EP01-W-07-BULK,Wardah Exclusive Eyeshadow Palette 01 Sunset Brown 10 g,Refill Press Exclusive Eye Shadow Palette 01 Sunset Brown 07,Exclusive Eye Shadow Palette 01 Sunset Brown 07,NOMINAL_LINE,7,72,9,9,4428,4561
JTK01,ES-EP01-W/72,COPACKING,PR03,ES-EP01-W,ES-EP01-W-06-RP-W1GR,ES-EP01-W-06-BULK,Wardah Exclusive Eyeshadow Palette 01 Sunset Brown 10 g,Refill Press Exclusive Eye Shadow Palette 01 Sunset Brown 06,Exclusive Eye Shadow Palette 01 Sunset Brown 06,NOMINAL_LINE,6,72,9,9,4428,4561
JTK01,ES-EP01-W/72,COPACKING,PR03,ES-EP01-W,ES-EP01-W-05-RP-W1GR,ES-EP01-W-05-BULK,Wardah Exclusive Eyeshadow Palette 01 Sunset Brown 10 g,Refill Press Exclusive Eye Shadow Palette 01 Sunset Brown 05,Exclusive Eye Shadow Palette 01 Sunset Brown 05,NOMINAL_LINE,5,72,9,9,4428,4561
JTK01,ES-EP01-W/72,COPACKING,PR03,ES-EP01-W,ES-EP01-W-04-RP-W1GR,ES-EP01-W-04-BULK,Wardah Exclusive Eyeshadow Palette 01 Sunset Brown 10 g,Refill Press Exclusive Eye Shadow Palette 01 Sunset Brown 04,Exclusive Eye Shadow Palette 01 Sunset Brown 04,NOMINAL_LINE,4,72,9,9,4428,4561
JTK01,ES-EP01-W/72,COPACKING,PR03,ES-EP01-W,ES-EP01-W-03-RP-W1GR,ES-EP01-W-03-BULK,Wardah Exclusive Eyeshadow Palette 01 Sunset Brown 10 g,Refill Press Exclusive Eye Shadow Palette 01 Sunset Brown 03,EXclusive eye Shadow Palette 01 Sunset Brown 03,NOMINAL_LINE,3,72,9,9,4428,4561
JTK01,ES-EP01-W/72,COPACKING,PR03,ES-EP01-W,ES-EP01-W-02-RP-W1GR,ES-EP01-W-02-BULK,Wardah Exclusive Eyeshadow Palette 01 Sunset Brown 10 g,Refill Press Exclusive Eye Shadow Palette 01 Sunset Brown 02,Exclusive EYe Shadow Palette 01 Sunset Brown 02,NOMINAL_LINE,2,72,9,9,4428,4561
JTK01,ES-EP01-W/72,COPACKING,PR03,ES-EP01-W,ES-EP01-W-01-RP-W1GR,ES-EP01-W-01-BULK,Wardah Exclusive Eyeshadow Palette 01 Sunset Brown 10 g,Refill Press Exclusive Eye Shadow Palette 01 Sunset Brown 01,Exclusive Eye Shadow Palette 01 Sunset Brown 01,NOMINAL_LINE,1,72,9,9,4428,4561
JTK04,L-EMC11DP-W/200,,,L-EMC11DP-W,,L-EMC11-BULK,Wardah Exclusive Matte Lip Cream 11 Oh So Nude ! 4g,,Exclusive Matte Lip Cream 11 Oh So Nude Bulk (Kg),SECONDARY_LINE,1,200,200,196,46080,46541
JTK04,L-EMC11DP-W/45,,,L-EMC11DP-W,,L-EMC11-BULK,Wardah Exclusive Matte Lip Cream 11 Oh So Nude ! 4g,,Exclusive Matte Lip Cream 11 Oh So Nude Bulk (Kg),NOMINAL_LINE,1,45,45,43.25,9792,9890
JTK01,DUSS-PMFW30R0-MO/0,SFGPack,PR16,DUSS-PMFW30R0-MO,,,Dus Sticker Powerstay Matte Powder Foundation W30 MO,,,NOMINAL_LINE,,0,0,0,576,593
JTK06,SRM-TAGTE-W100ML/0,STD,RR01,SRM-TAGTE-W100ML,,,Wardah Tester Renew You Treatment Essence 100 ml (Pc(s)),,,NOMINAL_LINE,,0,0,0,1,1
JTK02,S-P1L-P20/1000,STD,LR15,S-P1L-P20,,S-LL-BULK,Putri Pure Clean Shampoo Lemon 20 L (Pc(s)),,Shampoo Lemon Liter BULK (Kg),NOMINAL_LINE,1,1000,1000,982,49,60
JTK01,TC-PMC51-MO/10,STD,PR01,TC-PMC51-MO,,TC-PMC51-BULK,MAKE OVER Powerstay Matte Powder Foundation C51 Cool Tan 12 g,,MAKE OVER Powerstay Matte Powder Foundation C51 Cool Tan,SECONDARY_LINE,1,10,10,10,792,815
JTK01,TC-PMC51-MO/7,STD,PR01,TC-PMC51-MO,,TC-PMC51-BULK,MAKE OVER Powerstay Matte Powder Foundation C51 Cool Tan 12 g,,MAKE OVER Powerstay Matte Powder Foundation C51 Cool Tan,NOMINAL_LINE,1,7,7,7,504,520
JTK06,L-W2TE42-W3.8GR/0,STD,RR01,L-W2TE42-W3.8GR,,,Wardah Tester Container Exclusive Lipstick 42 Precious Violet 3.8 gr (Pc(s)),,,NOMINAL_LINE,,0,0,0,1,1
JTK06,A-TDM-W/0,STD,RR01,A-TDM-W,,,Wardah Tester Acnederm Day Moisturizer 40 ml,,,NOMINAL_LINE,,0,0,0,1,1
JTK02,FW-NFSBSACNE15-EM/650,STD,LR02,FW-NFSBSACNE15-EM,,FW-BSACNE-BULK,Emina NFS Bright Stuff for Acne Prone Skin Face Wash 15 ml,,Emina Bright Stuff for Acne Prone Skin Face Wash BULK,NOMINAL_LINE,1,650,650,620,37320,38624
JTK02,FW-AH-W60ML/3000,STD,LR15,FW-AH-W60ML,,FW-AH-BULK,Wardah Nature Daily Aloe Hydramild Facial Wash 60 ml,,Aloe Hydramild Facial Wash Bulk,NOMINAL_LINE,1,3000,3000,2910,47736,48736
JTK02,FW-AH-W60ML/3000,STD,LR15,FW-AH-W60ML,,FW-AH-BULK,Wardah Nature Daily Aloe Hydramild Facial Wash 60 ml,,Aloe Hydramild Facial Wash Bulk,NOMINAL_LINE,1,3000,3000,2910,47736,48736
JTK02,FW-AH-W60ML/3000,STD,LR15,FW-AH-W60ML,,FW-AH-BULK,Wardah Nature Daily Aloe Hydramild Facial Wash 60 ml,,Aloe Hydramild Facial Wash Bulk,NOMINAL_LINE,1,3000,3000,2910,47736,48736
JTK06,MY-SRMASRM-W/0,STD,RR01,MY-SRMASRM-W,,,Malaysia Wardah Acnederm Acne Care Serum 15 ml,,,NOMINAL_LINE,,0,0,0,22255,22255
JTK02,BUT-W3R-W150ML/1000,STD,LR15,BUT-W3R-W150ML,,BUT-W0R-BULK,Wardah Creamy Body Butter With Rose 150 ml (Pc(s)),,Rose Body Butter Bulk,SECONDARY_LINE,1,1000,1000,976,6473,6670
JTK02,BUT-W3R-W150ML/200,STD,LR15,BUT-W3R-W150ML,,BUT-W0R-BULK,Wardah Creamy Body Butter With Rose 150 ml (Pc(s)),,Rose Body Butter Bulk,NOMINAL_LINE,1,200,200,195,1239,1339
JTK02,BUT-W3R-W150ML/50,STD,LR15,BUT-W3R-W150ML,,BUT-W0R-BULK,Wardah Creamy Body Butter With Rose 150 ml (Pc(s)),,Rose Body Butter Bulk,SECONDARY_LINE,1,50,50,50,301,401
JTK06,MY-EBREPBL-W/0,STD,RR01,MY-EBREPBL-W,,,Malaysia Wardah EyeXpert Eyebrow Pencil Black 1.14 g (Blister),,,NOMINAL_LINE,,0,0,0,1,1
JTK02,M-RHDGN2-W/1000,STD,LR15,M-RHDGN2-W,,M-RHDG-BULK,Wardah Hydra Rose Dewy Aqua Day Gel 17 ml,,Wardah Hydra Rose Dewy Aqua Day Gel,SECONDARY_LINE,1,1000,1000,970,52881,58824
JTK02,M-RHDGN2-W/150,STD,LR15,M-RHDGN2-W,,M-RHDG-BULK,Wardah Hydra Rose Dewy Aqua Day Gel 17 ml,,Wardah Hydra Rose Dewy Aqua Day Gel,NOMINAL_LINE,1,150,150,141,8030,8271
JTK06,EC-TWSB-W/0,STD,RR01,EC-TWSB-W,,,Wardah Tester White Secret Brightening Eye Cream 10 ml,,,NOMINAL_LINE,,0,0,0,1,1
JTK06,MY-TTCE05CB-W12G/0,STD,RR01,MY-TTCE05CB-W12G,,,Wardah Tester Exclusive Two Way Cake 05 Coffee Beige 12 g,,,NOMINAL_LINE,,0,0,0,1,1
JTK06,CM-TSB-W150ML/0,STD,RR01,CM-TSB-W150ML,,,Wardah Tester Nature Daily Seaweed Balancing Cleanser 150 ml,,,NOMINAL_LINE,,0,0,0,1,1
JTK01,MY-RTCRE05-W/10,STD,PR01,MY-RTCRE05-W,,TC-PC05-BULK,Malaysia Wardah Exclusive Two Way Cake 05 Coffee Beige 12 g,,PERFECT COVER TWC 05 CINNAMON,NOMINAL_LINE,1,10,10,10,630,649
JTK02,S-P1A2-P20/1000,STD,LR15,S-P1A2-P20,,S-A2L-BULK,Putri Pure Clean Shampoo Apple 20 L (Pc(s)),,Shampoo Apple Liter BULK (Kg),NOMINAL_LINE,1,1000,1000,982,49,60
JTK06,L-NFSCUML08-W/0,STD,RR01,L-NFSCUML08-W,,,Sample Pajangan Wardah NFS Colorfit Ultralight Matte Lipstick 08 Woodsy Brown 3.6 g,,,NOMINAL_LINE,,0,0,0,4023,4104
JTK01,BASE-R3LLF-BULK/319.199999999999989,SFGBulk,PR08,BASE-R3LLF-BULK,,,Base Wardah Lightening Powder Foundation Light Feel,,,SECONDARY_LINE,1,319.2,319.2,319.2,0,0
JTK01,BASE-R3LLF-BULK/304,SFGBulk,PR08,BASE-R3LLF-BULK,,,Base Wardah Lightening Powder Foundation Light Feel,,,SECONDARY_LINE,1,304,304,304,0,0
JTK01,BASE-R3LLF-BULK/300,SFGBulk,PR08,BASE-R3LLF-BULK,,,Base Wardah Lightening Powder Foundation Light Feel,,,NOMINAL_LINE,1,300,300,300,0,0
JTK02,F-HGFN10-MO/150,STD,LR16,F-HGFN10-MO,,F-HGFN10-BULK,MAKE OVER Hydrastay Glow Fluid Foundation N10 Marble 35 ml,,MAKE OVER Hydrastay Glow Fluid Foundation N10 Marble,NOMINAL_LINE,1,150,150,131,3224,3324
JTK06,MY-LNLCD-EM/0,STD,RR01,MY-LNLCD-EM,,,Malaysia Emina Poppin’ Matte 03 Game On,,,NOMINAL_LINE,,0,0,0,425,425
JTK06,TC-TLLFNC4-W12G/0,STD,RR01,TC-TLLFNC4-W12G,,,Wardah Tester Container Lightening Two Way Cake Light Feel 04 Natural 12 g,,,NOMINAL_LINE,,0,0,0,1,1
JTK02,FW-FW01-KA/1000,STD,LR02,FW-FW01-KA,,FW-FW01-BULK,Kahf Gentle Exfoliating Face Scrub 100 ml,,KAHF - Gentle Exfoliating Face Scrub,NOMINAL_LINE,1,1000,1000,970,9120,9394
JTK02,BOTP-HTNTOH200R-P/0,SFGPack,LR13,BOTP-HTNTOH200R-P,,,Botol Print Hair Tonic Normal To Oily  Hijau Rev-1 200 ml P,,,NOMINAL_LINE,,0,0,0,1,1
JTK06,MY-MBSNC-EM/0,STD,RR01,MY-MBSNC-EM,,,Malaysia Emina Bright Stuff Night Cream 20 g,,,NOMINAL_LINE,,0,0,0,1,1
JTK01,TC-RVPMW60-MO/60,STD,PR01,TC-RVPMW60-MO,,TC-RVPMW60-BULK,MAKE OVER Powerstay 24H Matte Powder Foundation W60 Creme Cocoa 12 g,,MAKE OVER Powerstay 24H Matte Powder Foundation W60 Creme Cocoa,SECONDARY_LINE,1,60,60,60,4958,5058
JTK01,TC-RVPMW60-MO/20,STD,PR01,TC-RVPMW60-MO,,TC-RVPMW60-BULK,MAKE OVER Powerstay 24H Matte Powder Foundation W60 Creme Cocoa 12 g,,MAKE OVER Powerstay 24H Matte Powder Foundation W60 Creme Cocoa,SECONDARY_LINE,1,20,20,20,1200,1236
JTK01,TC-RVPMW60-MO/10,STD,PR01,TC-RVPMW60-MO,,TC-RVPMW60-BULK,MAKE OVER Powerstay 24H Matte Powder Foundation W60 Creme Cocoa 12 g,,MAKE OVER Powerstay 24H Matte Powder Foundation W60 Creme Cocoa,NOMINAL_LINE,1,10,10,10,150,150
JTK01,TC-RVPMW60-MO/7,STD,PR01,TC-RVPMW60-MO,,TC-RVPMW60-BULK,MAKE OVER Powerstay 24H Matte Powder Foundation W60 Creme Cocoa 12 g,,MAKE OVER Powerstay 24H Matte Powder Foundation W60 Creme Cocoa,SECONDARY_LINE,1,7,7,7,504,520
JTK02,BP-WSEDT-KA/400,STD,LR02,BP-WSEDT-KA,,BP-WSEDT-BULK,Kahf True Brotherhood Eau de Toilette 35 ml,,Kahf True Brotherhood Eau de Toilette Bulk,SECONDARY_LINE,1,400,400,385,10736,11059
JTK02,BP-WSEDT-KA/200,STD,LR02,BP-WSEDT-KA,,BP-WSEDT-BULK,Kahf True Brotherhood Eau de Toilette 35 ml,,Kahf True Brotherhood Eau de Toilette Bulk,NOMINAL_LINE,1,200,200,185,5055,5207
JTK02,CUS-EFC05-W/200,STD,LR05,CUS-EFC05-W,,CUS-EFC05-BULK,Wardah Exclusive Flawless Cover Cushion 05 Coffee Beige 15 g,,Wardah Exclusive Flawless Cover Cushion 05 Coffee Beige,SECONDARY_LINE,1,200,200,185,11963,12322
JTK02,CUS-EFC05-W/50,STD,LR04,CUS-EFC05-W,,CUS-EFC05-BULK,Wardah Exclusive Flawless Cover Cushion 05 Coffee Beige 15 g,,Wardah Exclusive Flawless Cover Cushion 05 Coffee Beige,NOMINAL_LINE,1,50,50,43,2691,2791
JTK01,ES-PRPCB-EM3.3GR/3,COPACKING,PR03,ES-PRPCB-EM3.3GR,"ES-W0I02RNFS1,3-W",ES-W0I-02 BULK,Emina Pop Rouge Pressed Eye Shadow Colorful 3.3 gr (Pc(s)),"Eye Shadow W0 I 02 Refill Not for Sale 1,33gr WNL Wardah (Pc(s))",EYE SHADOW I 02,NOMINAL_LINE,3,3,1,1,746,768
JTK01,ES-PRPCB-EM3.3GR/3,COPACKING,PR03,ES-PRPCB-EM3.3GR,"ES-W0I01RNFS1,3-W",ES-W0I-01 BULK,Emina Pop Rouge Pressed Eye Shadow Colorful 3.3 gr (Pc(s)),"Eye Shadow W0 I 01 Refill Not for Sale 1,33gr WNL Wardah (Pc(s))",EYE SHADOW I 01,NOMINAL_LINE,2,3,1,1,746,768
JTK01,ES-PRPCB-EM3.3GR/3,COPACKING,PR03,ES-PRPCB-EM3.3GR,"ES-TQ-RP-W1,3GR",ES-TQ-BULK,Emina Pop Rouge Pressed Eye Shadow Colorful 3.3 gr (Pc(s)),Refill Press Shiny Glam Eye Shadow Turqoise (Pc(s)),Shiny Glam Eye Shadow Turqoise,NOMINAL_LINE,1,3,1,1,746,768
JTK02,F-LLF04-W/1000,STD,LR20,F-LLF04-W,,F-LLF04-BULK,Wardah Lightening Liquid Foundation 04. Natural 25 ml (Blister),,Wardah Lightening Liquid Foundation 04. Natural bulk,SECONDARY_LINE,1,1000,1000,975,34416,35416
JTK02,F-LLF04-W/600,STD,LR20,F-LLF04-W,,F-LLF04-BULK,Wardah Lightening Liquid Foundation 04. Natural 25 ml (Blister),,Wardah Lightening Liquid Foundation 04. Natural bulk,NOMINAL_LINE,1,600,600,570,19386,20356
JTK02,F-LLF04-W/300,STD,LR20,F-LLF04-W,,F-LLF04-BULK,Wardah Lightening Liquid Foundation 04. Natural 25 ml (Blister),,Wardah Lightening Liquid Foundation 04. Natural bulk,SECONDARY_LINE,1,300,300,300,9797,10091
JTK02,L-PTG2-MO/34,STD,LR01,L-PTG2-MO,,L-PTG2-BULK,MAKE OVER Glassy Lip Lacquer X Hian Tjen 402 Social 4.5 g,,MAKE OVER Glassy Lip Lacquer 402 Social,SECONDARY_LINE,1,34,34,27,5616,5897
JTK02,L-PTG2-MO/32,STD,LR01,L-PTG2-MO,,L-PTG2-BULK,MAKE OVER Glassy Lip Lacquer X Hian Tjen 402 Social 4.5 g,,MAKE OVER Glassy Lip Lacquer 402 Social,SECONDARY_LINE,1,32,32,30,4680,4680
JTK02,L-PTG2-MO/20,STD,LR01,L-PTG2-MO,,L-PTG2-BULK,MAKE OVER Glassy Lip Lacquer X Hian Tjen 402 Social 4.5 g,,MAKE OVER Glassy Lip Lacquer 402 Social,NOMINAL_LINE,1,20,20,11,1668,2200
JTK02,WARN-M3AS-BULK/5,SFGBulk,LR19,WARN-M3AS-BULK,,,Pasta Warna Merah 3 AS bulk,,,NOMINAL_LINE,1,5,5,5,0,0
JTK01,TC-PC03-MO12G/60,STD,PR01,TC-PC03-MO12G,,TC-PC03-BULK,MAKE OVER Perfect Cover TWC 03 Maple 12 g (Pc(s)),,PERFECT COVER TWC 03 MAPLE,NOMINAL_LINE,1,60,60,60,4272,4400
JTK01,TC-RVIPMFPF12-W/100,STD,PR01,TC-RVIPMFPF12-W,,TC-IPMFPF12-BULK,Wardah Instaperfect MATTE FIT Powder Foundation Slongsong B 13 g,,Instaperfect MATTE FIT Powder Foundation 12 Ivory,NOMINAL_LINE,1,100,100,100,7576,7728
JTK01,TC-RVIPMFPF12-W/10,STD,PR01,TC-RVIPMFPF12-W,,TC-IPMFPF12-BULK,Wardah Instaperfect MATTE FIT Powder Foundation Slongsong B 13 g,,Instaperfect MATTE FIT Powder Foundation 12 Ivory,SECONDARY_LINE,1,10,10,10,581,598
JTK04,BOTP-WIEIM10R0-W/0,SFGPack,SR12,BOTP-WIEIM10R0-W,,,Bottle+Wiper Instaperfect EIM 10 La Vie En Rose W,,,NOMINAL_LINE,,0,0,0,1,1
JTK06,MY-LCM08-EM/0,STD,RR01,MY-LCM08-EM,,,Malaysia Emina Creamatte 08 Pumpkin Spice 5.5 gr,,,NOMINAL_LINE,,0,0,0,1,1
JTK06,MY-MAGDC-W30G/0,STD,RR01,MY-MAGDC-W30G,,,Malaysia Wardah Renew You Anti Aging Day Cream 30 g,,,NOMINAL_LINE,,0,0,0,1,1
JTK06,L-TIM05-W2.3G/0,STD,RR01,L-TIM05-W2.3G,,,Wardah Tester Intense Matte Lipstick 05 Easy Brownie 2.3 g (Pc(s)),,,NOMINAL_LINE,,0,0,0,1,1
JTK04,L-UHKP001-MO2.3G/5,STD,SR09,L-UHKP001-MO2.3G,,L-LLW0C6-BULK,MAKE OVER Ultra Hi-Matte Lipstick 001 King of Pink 2.3 g (Pc(s)),,Lipstick Long Lasting New 06 Wardah Bulk (Kg),SECONDARY_LINE,1,5,5,4.6,1524,1554
JTK04,L-UHKP001-MO2.3G/3,STD,SR09,L-UHKP001-MO2.3G,,L-LLW0C6-BULK,MAKE OVER Ultra Hi-Matte Lipstick 001 King of Pink 2.3 g (Pc(s)),,Lipstick Long Lasting New 06 Wardah Bulk (Kg),NOMINAL_LINE,1,3,3,2.75,1008,1038
JTK06,L-W2TEMC09-W4GR/0,STD,RR01,L-W2TEMC09-W4GR,,,Wardah Tester Exclusive Matte Lip Cream 09 Mauve On ! 4 gr (Pc(s)),,,NOMINAL_LINE,,0,0,0,1,1
JTK04,BOTP-PTMSE50-MO/0,SFGPack,SR12,BOTP-PTMSE50-MO,,,Bottle Print Powerstay TMLC Nude Colors SE 50 MO,,,NOMINAL_LINE,,0,0,0,1,1
JTK04,L-EMC17DP-W/200,,,L-EMC17DP-W,,L-EMC17-BULK,Wardah Exclusive Matte Lip Cream 17 Rosy Cheek 4g,,Exclusive Matte Lip Cream 17 Rosy Check,SECONDARY_LINE,1,200,200,196,46080,46541
JTK04,L-EMC17DP-W/45,,,L-EMC17DP-W,,L-EMC17-BULK,Wardah Exclusive Matte Lip Cream 17 Rosy Cheek 4g,,Exclusive Matte Lip Cream 17 Rosy Check,NOMINAL_LINE,1,45,45,43.25,9792,9890
JTK04,L-PTMCD-MO/15,STD,SR09,L-PTMCD-MO,,L-PTMCD-BULK,MAKE OVER Powerstay Transferproof Matte Lip Cream B12 Feisty 7 g,,MAKE OVER Powerstay Transferproof Matte Lip Cream B12 Feisty,NOMINAL_LINE,1,15,15,14,1870,1926
JTK01,B-R3L01LB-W/100,STD,PR01,B-R3L01LB-W,,B-R3L01LB-BULK,Wardah Lightening Matte Powder 01 Light Beige 20 g,,Wardah Lightening Matte Powder 01 Light Beige,NOMINAL_LINE,1,100,100,100,4648,4787
JTK01,B-R3L01LB-W/60,STD,PR01,B-R3L01LB-W,,B-R3L01LB-BULK,Wardah Lightening Matte Powder 01 Light Beige 20 g,,Wardah Lightening Matte Powder 01 Light Beige,SECONDARY_LINE,1,60,60,60,2716,2798
JTK06,L-TLL08-W2.3G/0,STD,RR01,L-TLL08-W2.3G,,,Wardah Tester Lipstick Longlasting 08 Red Velvet 2.3 g (Pc(s)),,,NOMINAL_LINE,,0,0,0,1,1
JTK04,L-REMO46-W/10,STD,SR09,L-REMO46-W,,L-REMO46-BULK,Wardah Exclusive Moist Lipstick 46 Chic Magenta 3.5 g,,Wardah Exclusive Moist Lipstick 46 Chic Magenta,NOMINAL_LINE,1,10,10,9.5,2280,2394
JTK02,S-CSCB01-B/120,STD,LR01,S-CSCB01-B,,S-CSCB-BULK,Beyondly Calm Barrier Collagen Serum,,Beyondly Calm Barrier Collagen Serum,NOMINAL_LINE,1,120,120,105,4487,4620
JTK01,TC-R2E02-W/300,STD,PR01,TC-R2E02-W,,TC-PC08-BULK,Wardah Exclusive Two Way Cake 02 Light Beige 12 g,,PERFECT COVER TWC 08 HONEY,SECONDARY_LINE,1,300,300,300,22050,22711
JTK01,TC-R2E02-W/60,STD,PR01,TC-R2E02-W,,TC-PC08-BULK,Wardah Exclusive Two Way Cake 02 Light Beige 12 g,,PERFECT COVER TWC 08 HONEY,NOMINAL_LINE,1,60,60,60,4350,4437
JTK06,MY-AASTG-W15ML/0,STD,RR01,MY-AASTG-W15ML,,,Malaysia Wardah Acnederm Acne Spot Treatment Gel 15 ml,,,NOMINAL_LINE,,0,0,0,1,1
