JTK02,HBL-NFSV1-WL/119,STD,LR02,HBL-NFSV1-WL,,HBL-V1-BULK,NFS Wonderly Brightening Serum Body Lotion Fearless 10 ml,,Glow Getter Brightening Body Lotion variant Fearless (Ungu),SECONDARY_LINE,1,119,119,104,8857,8946
JTK02,MY-RSRMCD-W/300,STD,LR15,MY-RSRMCD-W,,SRM-CD-BULK,Malaysia Wardah C-defense Serum 17 ml,,C-Defense Serum Bulk,NOMINAL_LINE,1,300,300,300,15960,16160
JTK02,FW-LWFN1-W/1000,STD,LR15,FW-LWFN1-W,,FW-LWF-BULK,Wardah Lightening Whip Facial Foam 50 ml,,Wardah Lightening Whip Facial Foam Bulk,NOMINAL_LINE,1,1000,1000,970,18500,19055
JTK06,MY-EBIPEM02-W/0,STD,RR01,MY-EBIPEM02-W,,,Malaysia Wardah Instaperfect BROWFLASH 3-in-1 Brow Perfector 02 Ash Brown 0.6 g,,,NOMINAL_LINE,,0,0,0,527,527
JTK02,CCC-CCL-EM20ML/50,STD,LR01,CCC-CCL-EM20ML,,CCC-CCL-BULK,Emina City Chic CC Cream Light 20 ml (Pc(s)),,CC Cream Bulk (Kg),NOMINAL_LINE,1,50,50,50,1310,1410
JTK04,L-LLS02-EM/20,STD,SR11,L-LLS02-EM,,L-LLS02-BULK,Emina Watercolor Lip Serum 02 Mist 2 g,,EMINA Watercolor Lip Serum 02 Mist,NOMINAL_LINE,1,20,20,19.5,8208,8454
JTK02,HBW-ETBWBN2-W/3000,STD,LR02,HBW-ETBWBN2-W,,HBW-ETBWB-BULK,Earth Love Life Javanese Moringa & Balinese Starfruit Body Wash 450 ml,,Earth Love Life Javanese Moringa & Balinese Starfruit Body Wash,NOMINAL_LINE,1,3000,3000,2910,6401,6590
JTK02,HBW-ETBWBN2-W/1000,STD,LR02,HBW-ETBWBN2-W,,HBW-ETBWB-BULK,Earth Love Life Javanese Moringa & Balinese Starfruit Body Wash 450 ml,,Earth Love Life Javanese Moringa & Balinese Starfruit Body Wash,SECONDARY_LINE,1,1000,1000,970,2134,2241
JTK02,L-PVW07-MO/50,STD,LR04,L-PVW07-MO,,L-PVW07-BULK,MAKE OVER Powerstay Vivid Waterlite Lip Stain A07 XOXO 5.5 g,,Lipstick Powerstay Vivid Waterlite XOXO Bulk (Kg),NOMINAL_LINE,1,50,50,50,8560,8817
JTK02,L-PVW07-MO/30,STD,LR04,L-PVW07-MO,,L-PVW07-BULK,MAKE OVER Powerstay Vivid Waterlite Lip Stain A07 XOXO 5.5 g,,Lipstick Powerstay Vivid Waterlite XOXO Bulk (Kg),SECONDARY_LINE,1,30,30,30,4923,5071
JTK02,EL-EXPELB-W/50,STD,LR02,EL-EXPELB-W,,EL-EXPELB-BULK,Wardah EYEXPERT Perfect Precision Liner 1 ml,,Wardah EYEXPERT Perfect Precision Liner,NOMINAL_LINE,1,50,50,45,34018,35719
JTK02,M-RWSDCN2-W/1000,STD,LR15,M-RWSDCN2-W,,M-RWSDC-BULK,Wardah Crystal Secret Brightening Day Cream 30 g,,Wardah Crystal Secret Brightening Day Cream,NOMINAL_LINE,1,1000,1000,971,31858,32814
JTK02,F-EXL01-MO/120,STD,LR10,F-EXL01-MO,,F-EXL01-BULK,MAKE OVER Expert Liquid Foundation 01 30 ml,,MAKE OVER Expert Liquid Foundation 01,NOMINAL_LINE,1,120,120,105,3285,3450
JTK01,TC-RPMN40-MO/100,STD,PR01,TC-RPMN40-MO,,TC-RPMN40-BULK,MAKE OVER Powerstay 24H Matte Powder Foundation N40 Sand 12 g,,MAKE OVER Powerstay 24H Matte Powder Foundation N40 Sand,SECONDARY_LINE,1,100,100,100,7692,7846
JTK01,TC-RPMN40-MO/60,STD,PR01,TC-RPMN40-MO,,TC-RPMN40-BULK,MAKE OVER Powerstay 24H Matte Powder Foundation N40 Sand 12 g,,MAKE OVER Powerstay 24H Matte Powder Foundation N40 Sand,SECONDARY_LINE,1,60,60,60,4320,4450
JTK01,TC-RPMN40-MO/20,STD,PR01,TC-RPMN40-MO,,TC-RPMN40-BULK,MAKE OVER Powerstay 24H Matte Powder Foundation N40 Sand 12 g,,MAKE OVER Powerstay 24H Matte Powder Foundation N40 Sand,NOMINAL_LINE,1,20,20,20,1200,1236
JTK01,TC-RPMN40-MO/10,STD,PR01,TC-RPMN40-MO,,TC-RPMN40-BULK,MAKE OVER Powerstay 24H Matte Powder Foundation N40 Sand 12 g,,MAKE OVER Powerstay 24H Matte Powder Foundation N40 Sand,SECONDARY_LINE,1,10,10,10,792,816
JTK01,TC-RPMN40-MO/7,STD,PR01,TC-RPMN40-MO,,TC-RPMN40-BULK,MAKE OVER Powerstay 24H Matte Powder Foundation N40 Sand 12 g,,MAKE OVER Powerstay 24H Matte Powder Foundation N40 Sand,SECONDARY_LINE,1,7,7,7,504,520
JTK06,"ES-W2TW0N-W3,3GR/0",STD,RR01,"ES-W2TW0N-W3,3GR",,,"Wardah Tester Eye Shadow N 3,3 gr",,,NOMINAL_LINE,,0,0,0,1,1
JTK04,L-REMA09-W/10,STD,SR09,L-REMA09-W,,L-REMA09-BULK,Wardah Exclusive Matte Lipstick 09 True Red 3.5 g,,Wardah Exclusive Matte 09 Lipstick True Red,NOMINAL_LINE,1,10,10,9.5,2016,2304
JTK02,SRM-PB-W/1000,STD,LR02,SRM-PB-W,,SRM-PB-BULK,Wardah Perfect Bright Super-Glow Berry Serum 8 ml,,Wardah Perfect Bright SuperGlow Berry Serum,NOMINAL_LINE,1,1000,1000,970,106111,109300
JTK02,SRM-PB-W/30,STD,LR02,SRM-PB-W,,SRM-PB-BULK,Wardah Perfect Bright Super-Glow Berry Serum 8 ml,,Wardah Perfect Bright SuperGlow Berry Serum,SECONDARY_LINE,1,30,30,26,3185,3345
JTK02,FW-AH-W100ML/3000,STD,LR01,FW-AH-W100ML,,FW-AH-BULK,Wardah Nature Daily Aloe Hydramild Facial Wash 100 ml,,Aloe Hydramild Facial Wash Bulk,NOMINAL_LINE,1,3000,3000,2910,28560,28714
JTK02,FW-AH-W100ML/3000,STD,LR01,FW-AH-W100ML,,FW-AH-BULK,Wardah Nature Daily Aloe Hydramild Facial Wash 100 ml,,Aloe Hydramild Facial Wash Bulk,NOMINAL_LINE,1,3000,3000,2910,28560,28714
JTK02,FW-AH-W100ML/3000,STD,LR01,FW-AH-W100ML,,FW-AH-BULK,Wardah Nature Daily Aloe Hydramild Facial Wash 100 ml,,Aloe Hydramild Facial Wash Bulk,NOMINAL_LINE,1,3000,3000,2910,28560,28714
JTK06,FW-AH-W100ML/0,STD,RR01,FW-AH-W100ML,,,Wardah Nature Daily Aloe Hydramild Facial Wash 100 ml,,,NOMINAL_LINE,,0,0,0,1,1
JTK06,MY-PRMPR-EM/0,STD,RR01,MY-PRMPR-EM,,,Malaysia Emina Pore Ranger 20 ml (Pc(s)),,,NOMINAL_LINE,,0,0,0,1,1
JTK02,HBW-ETBWE-W/1000,STD,LR02,HBW-ETBWE-W,,HBW-ETBWE-BULK,Earth Love Life South Bali Frangipani & Tropical Coconut Water Body Wash 250 ml,,Earth Love Life South Bali Frangipani & Tropical Coconut Water Body Wash,NOMINAL_LINE,1,1000,1000,975,3768,3957
JTK06,P-BIGB-MO/0,STD,RR01,P-BIGB-MO,,,Make Over Big Box 2: THE ROYAL,,,NOMINAL_LINE,,0,0,0,500,500
JTK02,REM-OIMW-MO/720,MULTIPLEBULK,LR15,REM-OIMW-MO,,REM-OIMW-BULK,MAKE OVER POWERSKIN Bi-Phase Oil Micellar Water 200 ml,,Make Over Powerskin Bi-Phase Micellar Oil Water Fase A,NOMINAL_LINE,1,720,535,521,3096,3196
JTK02,REM-OIMW-MO/720,MULTIPLEBULK,LR15,REM-OIMW-MO,,REM-OIMWB-BULK,MAKE OVER POWERSKIN Bi-Phase Oil Micellar Water 200 ml,,Make Over Powerskin Bi-Phase Micellar Oil Water Fase B,NOMINAL_LINE,2,720,185,181,3096,3196
JTK02,FW-PCSAC-KA/1000,STD,LR02,FW-PCSAC-KA,,FW-PCSAC-BULK,Kahf Oil and Acne Care Face Wash 100 ml,,Kahf Oil and Acne Care Face Wash,NOMINAL_LINE,1,1000,1000,970,9508,9790
JTK02,FW-PCSAC-KA/600,STD,LR02,FW-PCSAC-KA,,FW-PCSAC-BULK,Kahf Oil and Acne Care Face Wash 100 ml,,Kahf Oil and Acne Care Face Wash,SECONDARY_LINE,1,600,600,570,5512,5680
JTK02,FS-RLN2-W/1000,STD,LR15,FS-RLN2-W,,FS-RLN2-BULK,Wardah Lightening Gentle Exfoliator 50 ml,,Wardah Lightening Gentle Exfoliator,NOMINAL_LINE,1,1000,1000,1000,18850,19416
JTK04,EB-IPB3M01-W5.5G/45,STD,SR09,EB-IPB3M01-W5.5G,,EB-IPB3M01-BULK,Wardah Instaperfect BROWFESSIONAL 3D Brow Mascara 01. BROWN 5.5 g,,Wardah Instaperfect BROWFESSIONAL 3D Brow Mascara 01 BROWN,SECONDARY_LINE,1,45,45,44,7800,7956
JTK04,EB-IPB3M01-W5.5G/15,STD,SR09,EB-IPB3M01-W5.5G,,EB-IPB3M01-BULK,Wardah Instaperfect BROWFESSIONAL 3D Brow Mascara 01. BROWN 5.5 g,,Wardah Instaperfect BROWFESSIONAL 3D Brow Mascara 01 BROWN,NOMINAL_LINE,1,15,15,14,2456,2516
JTK04,EB-IPB3M01-W5.5G/3,STD,SR09,EB-IPB3M01-W5.5G,,EB-IPB3M01-BULK,Wardah Instaperfect BROWFESSIONAL 3D Brow Mascara 01. BROWN 5.5 g,,Wardah Instaperfect BROWFESSIONAL 3D Brow Mascara 01 BROWN,SECONDARY_LINE,1,3,3,2.75,432,453
JTK06,MY-TTCE04N-W12G/0,STD,RR01,MY-TTCE04N-W12G,,,Wardah Tester Exclusive Two Way Cake 04 Natural 12 g,,,NOMINAL_LINE,,0,0,0,1,1
JTK04,BO-COCBMM-W/80,STD,SR09,BO-COCBMM-W,,BO-COCBMM-BULK,Wardah Colorfit Cream Blush 02 MERRY MAUVE 3 g,,Wardah Colorfit Cream Blush 02 MERRY MAUVE bulk,SECONDARY_LINE,1,80,80,78,23904,24143
JTK04,BO-COCBMM-W/40,STD,SR09,BO-COCBMM-W,,BO-COCBMM-BULK,Wardah Colorfit Cream Blush 02 MERRY MAUVE 3 g,,Wardah Colorfit Cream Blush 02 MERRY MAUVE bulk,NOMINAL_LINE,1,40,40,38,11808,11916
JTK06,MY-LREMO46-W/0,STD,RR01,MY-LREMO46-W,,,Malaysia Wardah Exclusive Moist Lipstick 46 Chic Magenta 3.5 g,,,NOMINAL_LINE,,0,0,0,1,1
JTK06,MY-HBLAHMG-W100ML/0,STD,RR01,MY-HBLAHMG-W100ML,,,Malaysia Wardah Nature Daily Aloe Hydramild Multifunction Gel 100 ml,,,NOMINAL_LINE,,0,0,0,1,1
JTK02,M-NFSBRERMC-L/30,STD,LR02,M-NFSBRERMC-L,,M-BRERMC-BULK,LABORE Sensitive Skin Care NFS BiomeRepair Barrier Revive Cream 10 ml,,LABORÉ - Sensitive Skin Care BiomeRepair Barrier Revive Cream,NOMINAL_LINE,1,30,30,26.2,2026,2126
JTK06,M-NFSBRERMC-L/0,STD,RR01,M-NFSBRERMC-L,,,LABORE Sensitive Skin Care NFS BiomeRepair Barrier Revive Cream 10 ml,,,NOMINAL_LINE,,0,0,0,2146,2146
JTK06,BBC-NFSLN15-W/0,STD,RR01,BBC-NFSLN15-W,,,Sample Pajangan Wardah NFS Lightening BB Cream Natural 15 ml,,,NOMINAL_LINE,,0,0,0,1000,1030
JTK06,MY-FLLF03-W/0,STD,RR01,MY-FLLF03-W,,,Malaysia Wardah Lightening Liquid Foundation 03. Ivory 25 ml (Blister),,,NOMINAL_LINE,,0,0,0,1,1
JTK06,MY-LSLWCA-W/0,STD,RR01,MY-LSLWCA-W,,,Malaysia Wardah Colorfit Last All Day Lip Paint 12 Berry Lasting 4.2 g,,,NOMINAL_LINE,,0,0,0,1,1
JTK06,MY-TLEMC03-W4G/0,STD,RR01,MY-TLEMC03-W4G,,,Wardah Tester Exclusive Matte Lip Cream 03 See You Latte 4 g,,,NOMINAL_LINE,,0,0,0,1,1
JTK04,L-UHD018-MO2.3G/5,STD,SR09,L-UHD018-MO2.3G,,L-UHD018-BULK,MAKE OVER Ultra Hi-Matte Lipstick 018 Divine 2.3 g (Pc(s)),,Ultra Hi Matte Lipstick 018 Divine Bulk (Kg),SECONDARY_LINE,1,5,5,4.75,1524,1554
JTK04,L-UHD018-MO2.3G/3,STD,SR09,L-UHD018-MO2.3G,,L-UHD018-BULK,MAKE OVER Ultra Hi-Matte Lipstick 018 Divine 2.3 g (Pc(s)),,Ultra Hi Matte Lipstick 018 Divine Bulk (Kg),NOMINAL_LINE,1,3,3,2.75,1008,1038
JTK06,MY-LCVM10-W/0,STD,RR01,MY-LCVM10-W,,,Malaysia Wardah Colorfit Velvet Matte Lip Mousse 10 Lively Coral 4 g,,,NOMINAL_LINE,,0,0,0,1,1
JTK02,FW-3IN1PC-KA/1000,STD,LR02,FW-3IN1PC-KA,,FW-3IN1PC-BULK,Kahf Triple Action Oil and Comedo Defense Face Wash 100 ml,,Kahf Triple Action Oil and Comedo Defense Face Wash,NOMINAL_LINE,1,1000,1000,970,8850,9990
JTK06,P-SMB-MO/0,STD,RR01,P-SMB-MO,,,Make Over Small Box 2: THE MUSE,,,NOMINAL_LINE,,0,0,0,1250,1250
JTK06,L-W2TM05-W3.8GR/0,STD,RR01,L-W2TM05-W3.8GR,,,Wardah Tester Container Matte Lipstick 05 Peach 3.8 gr (Pc(s)),,,NOMINAL_LINE,,0,0,0,1,1
JTK06,CUS-IPBB11-W/0,STD,RR01,CUS-IPBB11-W,,,Wardah Instaperfect BOOKMARK MINERALIGHT MATTE BB Cushion 11. FAIR 15 g,,,NOMINAL_LINE,,0,0,0,10387,10406
JTK02,SRM-RLSAN1-W/1000,STD,LR15,SRM-RLSAN1-W,,SRM-RLSAN1-BULK,Wardah Lightening Serum Ampoule 30 ml,,Wardah Lightening Serum Ampoule botol 30 ml,NOMINAL_LINE,1,1000,1000,979,29475,30360
JTK02,POTP-CBAV720REV-P/0,SFGPack,LR13,POTP-CBAV720REV-P,,,Pot Print Creambath Aloe Vera Rev-1  720 ml Putri,,,NOMINAL_LINE,,0,0,0,1,1
JTK01,TC-R3LLF04-W/350,STD,PR01,TC-R3LLF04-W,,TC-R3LLF04-BULK,Wardah Lightening Powder Foundation Light Feel 04 Natural 12 g,,Wardah Lightening Powder Foundation Light Feel 04 Natural,SECONDARY_LINE,1,350,350,350,26460,27260
JTK01,TC-R3LLF04-W/100,STD,PR01,TC-R3LLF04-W,,TC-R3LLF04-BULK,Wardah Lightening Powder Foundation Light Feel 04 Natural 12 g,,Wardah Lightening Powder Foundation Light Feel 04 Natural,NOMINAL_LINE,1,100,100,100,7488,7712
JTK02,HBW-TBWN3C-BD/175,STD,LR15,HBW-TBWN3C-BD,,HBW-TBWC-BULK,TESTER Biodef Natural Protection Mint + Green Tea Body Wash 60 ml,,Tester Biodef Natural Protection Mint + Green Tea Body Wash,NOMINAL_LINE,1,175,175,170,2345,2540
JTK04,L-PTMC07-MO/45,STD,SR09,L-PTMC07-MO,,L-PTMC07-BULK,MAKE OVER Powerstay Transferproof Matte Lip Cream B07 Amplify 7 g,,Make Over Powerstay Transferproof Matte Lip Cream B07 Amplify,SECONDARY_LINE,1,45,45,44,5744,5916
JTK04,L-PTMC07-MO/15,STD,SR09,L-PTMC07-MO,,L-PTMC07-BULK,MAKE OVER Powerstay Transferproof Matte Lip Cream B07 Amplify 7 g,,Make Over Powerstay Transferproof Matte Lip Cream B07 Amplify,NOMINAL_LINE,1,15,15,14,1870,1926
JTK02,HBW-BWN5A-BD/1000,STD,LR02,HBW-BWN5A-BD,,HBW-BW-BULK,Biodef Natural Protection Mint + Sea Salt Body Wash Antiseptik Alami Botol 550 ml,,Biodef Natural Protection Mint + Sea Salt Body Wash Antiseptik Alami,NOMINAL_LINE,1,1000,1000,970,0,0
JTK01,TC-CPLS03-W/20,STD,PR01,TC-CPLS03-W,,TC-CPLS03-BULK,Wardah CRYSTALLURE Precious Luminizing Silk Powder Foundation 13 BEIGE 12 g,,WARDAH CRYSTALLURE Precious Luminizing Silk Powder Foundation 13 BEIGE,NOMINAL_LINE,1,20,20,20,1536,1590
JTK06,MY-TESM-W3.3G/0,STD,RR01,MY-TESM-W3.3G,,,Wardah Tester Eye Shadow M 3.3 g,,,NOMINAL_LINE,,0,0,0,1,1
JTK06,L-W2TE21-W3.8GR/0,STD,RR01,L-W2TE21-W3.8GR,,,Wardah Tester Container Exclusive Lipstick 21 Orchid Pink 3.8 gr (Pc(s)),,,NOMINAL_LINE,,0,0,0,1,1
JTK01,TC-RPMW33-MO/250,STD,PR01,TC-RPMW33-MO,,TC-RPMW33-BULK,MAKE OVER Powerstay 24H Matte Powder Foundation W33 Honey Beige 12 g,,MAKE OVER Powerstay 24H Matte Powder Foundation W33 Honey Beige,SECONDARY_LINE,1,250,250,250,19248,19825
JTK01,TC-RPMW33-MO/100,STD,PR01,TC-RPMW33-MO,,TC-RPMW33-BULK,MAKE OVER Powerstay 24H Matte Powder Foundation W33 Honey Beige 12 g,,MAKE OVER Powerstay 24H Matte Powder Foundation W33 Honey Beige,SECONDARY_LINE,1,100,100,100,7692,7846
JTK01,TC-RPMW33-MO/60,STD,PR01,TC-RPMW33-MO,,TC-RPMW33-BULK,MAKE OVER Powerstay 24H Matte Powder Foundation W33 Honey Beige 12 g,,MAKE OVER Powerstay 24H Matte Powder Foundation W33 Honey Beige,SECONDARY_LINE,1,60,60,60,4320,4450
JTK01,TC-RPMW33-MO/40,STD,PR01,TC-RPMW33-MO,,TC-RPMW33-BULK,MAKE OVER Powerstay 24H Matte Powder Foundation W33 Honey Beige 12 g,,MAKE OVER Powerstay 24H Matte Powder Foundation W33 Honey Beige,SECONDARY_LINE,1,40,40,40,2304,2373
JTK01,TC-RPMW33-MO/20,STD,PR01,TC-RPMW33-MO,,TC-RPMW33-BULK,MAKE OVER Powerstay 24H Matte Powder Foundation W33 Honey Beige 12 g,,MAKE OVER Powerstay 24H Matte Powder Foundation W33 Honey Beige,NOMINAL_LINE,1,20,20,20,1200,1236
JTK04,L-IPMLMP05-W5.5G/15,STD,SR09,L-IPMLMP05-W5.5G,,L-IPMLMP05-BULK,Wardah Instaperfect MATTESETTER Lip Matte Paint 05. HYPE 5.5 g,,Wardah Instaperfect MATTESETTER Lip Matte Paint 05 HYPE,SECONDARY_LINE,1,15,15,14,2363,2492
JTK04,L-IPMLMP05-W5.5G/3,STD,SR09,L-IPMLMP05-W5.5G,,L-IPMLMP05-BULK,Wardah Instaperfect MATTESETTER Lip Matte Paint 05. HYPE 5.5 g,,Wardah Instaperfect MATTESETTER Lip Matte Paint 05 HYPE,NOMINAL_LINE,1,3,3,2.5,396,415
JTK02,FW-PBCFLS100-W/3000,STD,LR01,FW-PBCFLS100-W,,FW-PBCFLS-BULK,Wardah Perfect Bright Creamy Foam Brightening + Smoothing 100 ml (Pc(s)),,Wardah Perfect Bright Creamy Foam Brightening + Smoothing BULK,NOMINAL_LINE,1,3000,3000,2943,28860,29014
JTK02,BBC-LN-W15ML/500,STD,LR01,BBC-LN-W15ML,,BBC-LN-BULK,Wardah Lightening BB Cream Natural 15 ml (pc(s)),,Lightening BB Cream Natural Bulk,NOMINAL_LINE,1,500,500,500,28550,29410
JTK06,MY-LEMC10-W4G/0,STD,RR01,MY-LEMC10-W4G,,,Malaysia Wardah Exclusive Matte Lip Cream 10 Berry Pretty 4 g (Pc(s)),,,NOMINAL_LINE,,0,0,0,1,1
JTK02,M-RPBNS-W20ML/1000,STD,LR15,M-RPBNS-W20ML,,M-RPBNS-BULK,Wardah Perfect Bright Moisturizer Normal Skin 20 ml (Pc(s)),,Wardah Perfect Bright Moisturizer Normal Skin Bulk,NOMINAL_LINE,1,1000,1000,1000,43380,44380
JTK02,F-LUC03-MO33ML/240,STD,LR05,F-LUC03-MO33ML,,F-LUC03-BULK,MAKE OVER Ultra Cover Liquid Matt Foundation 03 Nude Silk 33 ml (pc(s)),,Ultra Cover Liquid Matt Foundation 03 Nude Silk Bulk,SECONDARY_LINE,1,240,240,240,5780,6517
JTK02,F-LUC03-MO33ML/240,STD,LR15,F-LUC03-MO33ML,,F-LUC03-BULK,MAKE OVER Ultra Cover Liquid Matt Foundation 03 Nude Silk 33 ml (pc(s)),,Ultra Cover Liquid Matt Foundation 03 Nude Silk Bulk,NOMINAL_LINE,1,240,240,240,5780,6517
JTK02,F-LUC03-MO33ML/200,STD,LR15,F-LUC03-MO33ML,,F-LUC03-BULK,MAKE OVER Ultra Cover Liquid Matt Foundation 03 Nude Silk 33 ml (pc(s)),,Ultra Cover Liquid Matt Foundation 03 Nude Silk Bulk,SECONDARY_LINE,1,200,200,194,4920,5767
JTK06,L-W2TEMC03-W4GR/0,STD,RR01,L-W2TEMC03-W4GR,,,Wardah Tester Exclusive Matte Lip Cream 03 See You Latte 4 gr (Pc(s)),,,NOMINAL_LINE,,0,0,0,1,1
JTK02,FW-CSGC01-B/1000,STD,LR01,FW-CSGC01-B,,FW-CSGC-BULK,Beyondly Glowlasting Collagen Cleanser,,Beyondly Glowlasting Collagen Cleanser,NOMINAL_LINE,1,1000,1000,970,9455,9740
JTK06,P-WSW-W/0,STD,RR01,P-WSW-W,,,Wardah Bundling White Secret - Watson,,,NOMINAL_LINE,,0,0,0,912,912
JTK06,MY-LGS03-EM/0,STD,RR01,MY-LGS03-EM,,,Malaysia Emina Glossy Stain 03 Candy Rain 3 g,,,NOMINAL_LINE,,0,0,0,1,1
JTK06,TC-TLLFB4C1-W12G/0,STD,RR01,TC-TLLFB4C1-W12G,,,Wardah Tester Container Lightening Two Way Cake Light Feel 01 Light Beige 12 g,,,NOMINAL_LINE,,0,0,0,1,1
JTK02,L-CLCLS3-W/400,STD,LR05,L-CLCLS3-W,,L-CLCLS3-BULK,Wardah Colorfit Fresh Matte Lip Ink 03 High Rise 4 g,,Wardah Colorfit Fresh Matte Lip Ink 03 High Rise,SECONDARY_LINE,1,400,400,375,89548,90548
JTK02,L-CLCLS3-W/400,STD,LR05,L-CLCLS3-W,,L-CLCLS3-BULK,Wardah Colorfit Fresh Matte Lip Ink 03 High Rise 4 g,,Wardah Colorfit Fresh Matte Lip Ink 03 High Rise,SECONDARY_LINE,1,400,400,375,89548,90548
JTK02,L-CLCLS3-W/200,STD,LR04,L-CLCLS3-W,,L-CLCLS3-BULK,Wardah Colorfit Fresh Matte Lip Ink 03 High Rise 4 g,,Wardah Colorfit Fresh Matte Lip Ink 03 High Rise,SECONDARY_LINE,1,200,200,189,43572,45814
JTK02,L-CLCLS3-W/200,STD,LR04,L-CLCLS3-W,,L-CLCLS3-BULK,Wardah Colorfit Fresh Matte Lip Ink 03 High Rise 4 g,,Wardah Colorfit Fresh Matte Lip Ink 03 High Rise,NOMINAL_LINE,1,200,200,189,43572,45814
JTK04,L-UHSR003-MO2.3G/5,STD,SR09,L-UHSR003-MO2.3G,,L-LLW0C8-BULK,MAKE OVER Ultra Hi-Matte Lipstick 003 Sophist Red 2.3 g (Pc(s)),,Lipstick Long Lasting New 08 Wardah Bulk (Kg),SECONDARY_LINE,1,5,5,4.75,1524,1554
JTK04,L-UHSR003-MO2.3G/3,STD,SR09,L-UHSR003-MO2.3G,,L-LLW0C8-BULK,MAKE OVER Ultra Hi-Matte Lipstick 003 Sophist Red 2.3 g (Pc(s)),,Lipstick Long Lasting New 08 Wardah Bulk (Kg),NOMINAL_LINE,1,3,3,2.75,1008,1038
JTK02,POTS-OBS150N_L-P/0,SFGPack,LR13,POTS-OBS150N_L-P,,,Pot Sticker Olive Body Scrub 150 ml Putri,,,NOMINAL_LINE,,0,0,0,1,1
JTK02,BOTP-ILSLS05R0-W/0,SFGPack,LR13,BOTP-ILSLS05R0-W,,,Bottle Printed Instaperfect LSL 05 W,,,NOMINAL_LINE,,0,0,0,1,1
JTK02,BOTP-ILSLS05R0-W/0,SFGPack,LR13,BOTP-ILSLS05R0-W,,,Bottle Printed Instaperfect LSL 05 W,,,NOMINAL_LINE,,0,0,0,1,1
JTK02,CUS-IPE-W/120,STD,LR04,CUS-IPE-W,,CUS-IPE-BULK,Instaperfect Skincover Air Cushion 43 Creme Sand 11 g,,Instaperfect Skincover Air Cushion 43 Creme Sand,SECONDARY_LINE,1,120,120,105,7824,7978
JTK02,CUS-IPE-W/30,STD,LR04,CUS-IPE-W,,CUS-IPE-BULK,Instaperfect Skincover Air Cushion 43 Creme Sand 11 g,,Instaperfect Skincover Air Cushion 43 Creme Sand,NOMINAL_LINE,1,30,30,23,1416,1460
JTK01,FA-EGH-W/60,PRESSTHENFILLINGPACKING,PR03,FA-EGH-W,"FA-EGH-RP-W6,5G",FA-EGH-BULK,Wardah Exclusive Glowing Highlighter 6.5 g,Refill Press Wardah Exclusive Glowing Highlighter,Wardah Exclusive Glowing Highlighter,NOMINAL_LINE,1,60,60,60,8592,8850
JTK01,FA-EGH-W/14,PRESSTHENFILLINGPACKING,PR03,FA-EGH-W,"FA-EGH-RP-W6,5G",FA-EGH-BULK,Wardah Exclusive Glowing Highlighter 6.5 g,Refill Press Wardah Exclusive Glowing Highlighter,Wardah Exclusive Glowing Highlighter,SECONDARY_LINE,1,14,14,14,2016,2076
JTK06,MY-TLEMC09-W4G/0,STD,RR01,MY-TLEMC09-W4G,,,Wardah Tester Exclusive Matte Lip Cream 09 Mauve On! 4 g,,,NOMINAL_LINE,,0,0,0,1,1
JTK02,F-HGFW42-MO/150,STD,LR10,F-HGFW42-MO,,F-HGFW42-BULK,MAKE OVER Hydrastay Glow Fluid Foundation W42 Warm Sand 35 ml,,MAKE OVER Hydrastay Glow Fluid Foundation W42 Warm Sand,NOMINAL_LINE,1,150,150,138,3302,3402
JTK06,L-TIM04-W2.3G/0,STD,RR01,L-TIM04-W2.3G,,,Wardah Tester Intense Matte Lipstick 04 Mauve Mellow 2.3 g (Pc(s)),,,NOMINAL_LINE,,0,0,0,1,1
JTK04,L-IPMLMP09-W/15,STD,SR09,L-IPMLMP09-W,,L-IPMLMP09-BULK,Wardah Instaperfect MATTESETTER Lip Matte Paint 09. ICON 5.5 g,,Wardah Instaperfect MATTESETTER Lip Matte Paint 09. ICON,SECONDARY_LINE,1,15,15,14,2363,2492
JTK04,L-IPMLMP09-W/3,STD,SR09,L-IPMLMP09-W,,L-IPMLMP09-BULK,Wardah Instaperfect MATTESETTER Lip Matte Paint 09. ICON 5.5 g,,Wardah Instaperfect MATTESETTER Lip Matte Paint 09. ICON,NOMINAL_LINE,1,3,3,2.5,396,415
JTK06,MY-SRMAGTE-W100ML/0,STD,RR01,MY-SRMAGTE-W100ML,,,Malaysia Wardah Renew You Treatment Essence 100 ml,,,NOMINAL_LINE,,0,0,0,1,1
JTK01,TC-CPLSRCRE-W/20,STD,PR01,TC-CPLSRCRE-W,,TC-CPLS04-BULK,Wardah CRYSTALLURE Precious Luminizing Silk Powder Foundation Refill 14 CREME 12 g,,WARDAH CRYSTALLURE Precious Luminizing Silk Powder Foundation 14 CREME,NOMINAL_LINE,1,20,20,20,1625,1825
JTK06,L-W2TM02-W3.8GR/0,STD,RR01,L-W2TM02-W3.8GR,,,Wardah Tester Container Matte Lipstick 02 Pink 3.8 gr (Pc(s)),,,NOMINAL_LINE,,0,0,0,1,1
JTK06,BO-W2TC-W4GR/0,STD,RR01,BO-W2TC-W4GR,,,Wardah Tester Container Blush On Seri C 4 gr (Pc(s)),,,NOMINAL_LINE,,0,0,0,1,1
JTK01,TWC-CLFTRF-W/20,STD,PR01,TWC-CLFTRF-W,,TWC-CLFTF-BULK,Wardah Colorfit Velvet Powder Foundation Refill 43W Golden Sand 11 g,,Colorfit Velvet Powder Foundation 43W Golden Sand,NOMINAL_LINE,1,20,20,20,1548,1600
JTK06,MY-FWRYAG-W100ML/0,STD,RR01,MY-FWRYAG-W100ML,,,Malaysia Wardah Renew You Anti Aging Facial Wash 100 ml,,,NOMINAL_LINE,,0,0,0,1,1
JTK02,HBW-EB-KA/3000,STD,LR15,HBW-EB-KA,,HBW-EB-BULK,Kahf Brightening and Cooling Body Wash 200 ml,,Kahf Brightening and Cooling Body Wash,NOMINAL_LINE,1,3000,3000,2910,13973,14390
JTK01,DUSS-PMFW22R0-MO/0,SFGPack,PR16,DUSS-PMFW22R0-MO,,,Dus Sticker Powerstay Matte Powder Foundation W22 MO,,,NOMINAL_LINE,,0,0,0,4320,4450
JTK02,SS-UVSAFE-W/1000,STD,LR02,SS-UVSAFE-W,,SS-UVSAFE-BULK,Wardah UV Shield Aqua Fresh Essence SPF 50 30 ml,,Wardah UV Shield Aqua Fresh Essence SPF 50,NOMINAL_LINE,1,1000,1000,1000,30558,31475
JTK04,DUSS-EMLC16H-W/0,SFGPack,SR12,DUSS-EMLC16H-W,,,Dus Sticker Exclusive Matte Lip Cream 16 (Hologram) W,,,NOMINAL_LINE,1,0,0,0,18688,18688
JTK06,MY-LIPEI02-W/0,STD,RR01,MY-LIPEI02-W,,,Malaysia Wardah Instaperfect Everlast Intense Matte Liquid 02 TIMELESS 4.2 g,,,NOMINAL_LINE,,0,0,0,1,1
JTK06,F-W2TELLNW-W40ML/0,STD,RR01,F-W2TELLNW-W40ML,,,Wardah Tester Container Evd Lum Liquid Foundation 01 Natural White 40 ml (Pc(s)),,,NOMINAL_LINE,,0,0,0,1,1
JTK06,MY-SRMASSE-EM/0,STD,RR01,MY-SRMASSE-EM,,,Malaysia Emina Ms. Pimple Acne Solution Spot Gel 15 ml,,,NOMINAL_LINE,,0,0,0,1,1
JTK04,BO-MMB03-MO/100,STD,SR09,BO-MMB03-MO,,BO-MMB03-BULK,MAKE OVER Multifix Matte Blusher 03 Blush Rush 9 g,,MAKE OVER Multifix Matte Blusher 03 Blush Rush,SECONDARY_LINE,1,100,100,98,9888,10086
JTK04,BO-MMB03-MO/80,STD,SR09,BO-MMB03-MO,,BO-MMB03-BULK,MAKE OVER Multifix Matte Blusher 03 Blush Rush 9 g,,MAKE OVER Multifix Matte Blusher 03 Blush Rush,SECONDARY_LINE,1,80,80,78,7824,7981
JTK04,BO-MMB03-MO/40,STD,SR09,BO-MMB03-MO,,BO-MMB03-BULK,MAKE OVER Multifix Matte Blusher 03 Blush Rush 9 g,,MAKE OVER Multifix Matte Blusher 03 Blush Rush,SECONDARY_LINE,1,40,40,39,3840,3917
JTK04,BO-MMB03-MO/10,STD,SR09,BO-MMB03-MO,,BO-MMB03-BULK,MAKE OVER Multifix Matte Blusher 03 Blush Rush 9 g,,MAKE OVER Multifix Matte Blusher 03 Blush Rush,NOMINAL_LINE,1,10,10,9.5,978,1033
JTK04,L-RIPEI04-W/15,STD,SR09,L-RIPEI04-W,,L-RIPEI04-BULK,Instaperfect Everlast Intense Matte Liquid 04 GRANDE 4.2 g,,Instaperfect Everlast Intense Matte Liquid 04 GRANDE,NOMINAL_LINE,1,15,15,14,3024,3145
JTK04,L-RIPEI04-W/3,STD,SR09,L-RIPEI04-W,,L-RIPEI04-BULK,Instaperfect Everlast Intense Matte Liquid 04 GRANDE 4.2 g,,Instaperfect Everlast Intense Matte Liquid 04 GRANDE,SECONDARY_LINE,1,3,3,2.5,432,460
JTK01,ES-TEB-MO6G/9,COPACKING,PR03,ES-TEB-MO6G,ES-TPMS2GRRNFS-MO,ES-SD-BULK,MAKE OVER Trivia Eye Shadow Emperor Brown 6 g (Pc(s)),Eye Shadow Trivia Perfect Matte Sand 2gr Refill No Make Over (Pc(s)),Perfect Matte Eye Shadow Sand,NOMINAL_LINE,3,9,3,3,828,853
JTK01,ES-TEB-MO6G/6,COPACKING,PR03,ES-TEB-MO6G,ES-TPMS2GRRNFS-MO,ES-SD-BULK,MAKE OVER Trivia Eye Shadow Emperor Brown 6 g (Pc(s)),Eye Shadow Trivia Perfect Matte Sand 2gr Refill No Make Over (Pc(s)),Perfect Matte Eye Shadow Sand,SECONDARY_LINE,3,6,2,2,756,806
JTK01,ES-TEB-MO6G/9,COPACKING,PR03,ES-TEB-MO6G,ES-TPMHS2GRRNFS-MO,ES-H-X,MAKE OVER Trivia Eye Shadow Emperor Brown 6 g (Pc(s)),Eye Shadow Trivia Perfect Matte Hot Stone 2gr Refi Make Over (Pc(s)),Perfect Matte Eye Shadow Hot Stone,NOMINAL_LINE,2,9,3,3,828,853
JTK01,ES-TEB-MO6G/6,COPACKING,PR03,ES-TEB-MO6G,ES-TPMHS2GRRNFS-MO,ES-H-X,MAKE OVER Trivia Eye Shadow Emperor Brown 6 g (Pc(s)),Eye Shadow Trivia Perfect Matte Hot Stone 2gr Refi Make Over (Pc(s)),Perfect Matte Eye Shadow Hot Stone,SECONDARY_LINE,2,6,2,2,756,806
JTK01,ES-TEB-MO6G/9,COPACKING,PR03,ES-TEB-MO6G,ES-TPMC2GRRNFS-MO,ES-C-BULK,MAKE OVER Trivia Eye Shadow Emperor Brown 6 g (Pc(s)),Eye Shadow Trivia Perfect Matte Cocoa 2gr Refill N Make Over (Pc(s)),Perfect Matte Eye Shadow Cocoa,NOMINAL_LINE,1,9,3,3,828,853
JTK01,ES-TEB-MO6G/6,COPACKING,PR03,ES-TEB-MO6G,ES-TPMC2GRRNFS-MO,ES-C-BULK,MAKE OVER Trivia Eye Shadow Emperor Brown 6 g (Pc(s)),Eye Shadow Trivia Perfect Matte Cocoa 2gr Refill N Make Over (Pc(s)),Perfect Matte Eye Shadow Cocoa,SECONDARY_LINE,1,6,2,2,756,806
JTK04,L-IPEI09-W/55,STD,SR09,L-IPEI09-W,,L-IPEI09-BULK,Wardah Instaperfect Everlast Intense Matte Liquid 09 QUE SERA SERA 4.2 g,,Wardah Instaperfect Everlast Intense Matte Liquid 09 Que Sera Sera,NOMINAL_LINE,1,55,55,53.5,11520,11866
JTK04,L-CSGC102-MO/5,STD,SR09,L-CSGC102-MO,,L-CSGC102-BULK,MAKE OVER Color Stick Gloss Crayon 102 Abigail 3 g,,Make Over Color Stick Gloss Crayon 102 Abigail,NOMINAL_LINE,1,5,5,4.75,1320,1380
JTK04,L-CSGC102-MO/0.75,STD,SR09,L-CSGC102-MO,,L-CSGC102-BULK,MAKE OVER Color Stick Gloss Crayon 102 Abigail 3 g,,Make Over Color Stick Gloss Crayon 102 Abigail,NOMINAL_LINE,1,0.75,0.75,0.65,180,189
JTK02,BUT-W0O-W100ML/200,STD,LR15,BUT-W0O-W100ML,,BUT-W0O-BULK,Wardah Creamy Body Butter With Olive 100 ml (pc(s)),,WARDAH Creamy Body Butter with Olive Bulk,SECONDARY_LINE,1,200,200,197,1795,1895
JTK02,BUT-W0O-W100ML/120,STD,LR15,BUT-W0O-W100ML,,BUT-W0O-BULK,Wardah Creamy Body Butter With Olive 100 ml (pc(s)),,WARDAH Creamy Body Butter with Olive Bulk,SECONDARY_LINE,1,120,120,105,990,1040
JTK02,BUT-W0O-W100ML/30,STD,LR15,BUT-W0O-W100ML,,BUT-W0O-BULK,Wardah Creamy Body Butter With Olive 100 ml (pc(s)),,WARDAH Creamy Body Butter with Olive Bulk,NOMINAL_LINE,1,30,30,30,218,318
JTK02,HT-P1G1-P200/1000,STD,LR15,HT-P1G1-P200,,HT-G1-BULK,"Hair Tonic Normal to Oily Hair (Green), 200 ml",,Bulk Hair Tonic Green,NOMINAL_LINE,1,1000,1000,985,5160,5418
JTK02,HT-P1G1-P200/1000,STD,LR15,HT-P1G1-P200,,HT-G1-BULK,"Hair Tonic Normal to Oily Hair (Green), 200 ml",,Bulk Hair Tonic Green,NOMINAL_LINE,1,1000,1000,985,5160,5418
JTK02,FM-AIS-EM30G/600,STD,LR15,FM-AIS-EM30G,,FM-AIS-BULK,Emina Aqua Infused Sleeping Mask 30 g,,Aqua Infused Sleeping Mask Bulk,NOMINAL_LINE,1,600,600,600,18256,18800
